[
  {
    "id": "source-community-spiritvalewiki-skills",
    "name": "SpiritVale Wiki Community Skills",
    "sourceType": "community",
    "url": "https://spiritvalewiki.com/skills/",
    "owner": "SpiritVale Wiki community maintainers",
    "accessedAt": "2026-08-10T00:00:00Z",
    "reliability": "secondary",
    "notes": "Secondary community Skill source. Individual detail pages provide stable locators, names, descriptions, class labels, max levels, cooldowns and costs. The site also publishes ranking/build material; those claims and damage-scaling fields are excluded from this registration.",
    "sourceId": "source-community-spiritvalewiki-skills",
    "sourceAuthority": "community-maintained-database",
    "sourceUrl": "https://spiritvalewiki.com/skills/",
    "publisher": "SpiritVale Wiki community maintainers",
    "verificationLevel": 2,
    "lastChecked": "2026-08-10T00:00:00Z",
    "allowedFields": ["name", "shortDescription", "description", "classIds", "maxLevel", "cooldownSeconds", "resourceCost", "effectText", "notes"]
  },
  {
    "id": "source-community-spiritvaledb-skills",
    "name": "SpiritVale DB Community Skills",
    "sourceType": "community",
    "url": "https://www.spiritvaledb.com/database/skills",
    "owner": "SpiritVale DB community maintainers",
    "accessedAt": "2026-08-10T00:00:00Z",
    "reliability": "secondary",
    "notes": "Community-maintained skill index. It is not affiliated with or endorsed by the SpiritVale developer. Individual skill names, descriptions, class labels, effects, cooldowns, costs and max levels are accepted only when the exact listing and locator are retained; ranking, DPS, meta and best-build claims are never imported.",
    "sourceId": "source-community-spiritvaledb-skills",
    "sourceAuthority": "community-maintained-database",
    "sourceUrl": "https://www.spiritvaledb.com/database/skills",
    "publisher": "SpiritVale DB community maintainers",
    "verificationLevel": 2,
    "lastChecked": "2026-08-10T00:00:00Z",
    "allowedFields": ["name", "shortDescription", "description", "classIds", "maxLevel", "cooldownSeconds", "resourceCost", "effectText", "notes"]
  },
  {
    "id": "source-official-steam-store",
    "name": "SpiritVale Official Steam Store",
    "sourceType": "official",
    "url": "https://store.steampowered.com/app/3767850/SpiritVale/",
    "owner": "Baikun Interactive",
    "accessedAt": "2026-08-01T00:00:00Z",
    "reliability": "primary",
    "notes": "Official product page used to verify the seven listed base-class names and system-level statements. Individual Card fields are allowed only when the page explicitly publishes them.",
    "sourceId": "source-official-steam-store",
    "sourceAuthority": "publisher",
    "sourceUrl": "https://store.steampowered.com/app/3767850/SpiritVale/",
    "publisher": "Baikun Interactive",
    "verificationLevel": 1,
    "lastChecked": "2026-08-10T00:00:00Z",
    "allowedFields": ["name", "category", "rarity", "effect", "description", "location", "drop", "imageAssetId", "notes"]
  },
  {
    "id": "source-official-press-kit",
    "name": "SpiritVale Official Press Kit",
    "sourceType": "official",
    "url": "https://impress.games/press-kit/baikun-interactive/spiritvale",
    "owner": "Baikun Interactive",
    "accessedAt": "2026-08-01T00:00:00Z",
    "reliability": "primary",
    "notes": "Official Baikun Interactive Press Kit used for verified source assets; it does not authorize individual gameplay fields unless explicitly documented.",
    "sourceId": "source-official-press-kit",
    "sourceAuthority": "publisher",
    "sourceUrl": "https://impress.games/press-kit/baikun-interactive/spiritvale",
    "publisher": "Baikun Interactive",
    "verificationLevel": 1,
    "lastChecked": "2026-08-10T00:00:00Z",
    "allowedFields": ["description", "imageAssetId", "notes"]
  },
  {
    "id": "source-community-spiritvale-info-cards",
    "name": "SpiritVale Info Community Cards",
    "sourceType": "community",
    "url": "https://www.spiritvale.info/cards",
    "owner": "SpiritVale Info community maintainers",
    "accessedAt": "2026-08-10T00:00:00Z",
    "reliability": "secondary",
    "notes": "Community-maintained Card index. It is not affiliated with or endorsed by the SpiritVale developer. Individual fields require evidence and human review before publication.",
    "sourceId": "source-community-spiritvale-info-cards",
    "sourceAuthority": "community-maintained-database",
    "sourceUrl": "https://www.spiritvale.info/cards",
    "publisher": "SpiritVale Info community maintainers",
    "verificationLevel": 2,
    "lastChecked": "2026-08-10T00:00:00Z",
    "allowedFields": ["name", "description", "category", "rarity", "effect", "notes"]
  },
  {
    "id": "source-community-spiritvale-info-equipment",
    "name": "SpiritVale Info Community Equipment",
    "sourceType": "community",
    "url": "https://www.spiritvale.info/equipment",
    "owner": "SpiritVale Info community maintainers",
    "accessedAt": "2026-08-10T00:00:00Z",
    "reliability": "secondary",
    "notes": "Equipment source qualification pilot only. Community-maintained and not affiliated with or endorsed by the SpiritVale developer. Structured listings and detail pages expose selected equipment fields with page-level evidence; rarity is not consistently published and is intentionally excluded. No entity is approved by this registration alone.",
    "sourceId": "source-community-spiritvale-info-equipment",
    "sourceAuthority": "community-maintained-database",
    "sourceUrl": "https://www.spiritvale.info/equipment",
    "publisher": "SpiritVale Info community maintainers",
    "verificationLevel": 2,
    "lastChecked": "2026-08-10T00:00:00Z",
    "allowedFields": ["name", "description", "category", "stats", "effect", "location", "drop", "notes"]
  },
  {
    "id": "source-community-spiritvale-info-monsters",
    "name": "SpiritVale Info Community Monsters",
    "sourceType": "community",
    "url": "https://www.spiritvale.info/monsters",
    "owner": "SpiritVale Info community maintainers",
    "accessedAt": "2026-08-10T00:00:00Z",
    "reliability": "secondary",
    "notes": "Monster source qualification pilot only. Individual pages visibly publish names, levels, locations and drop listings. The source is community-maintained and not affiliated with or endorsed by the SpiritVale developer; unsupported stats, weaknesses, resistances, skills, spawn rates and drop rates must not be inferred.",
    "sourceId": "source-community-spiritvale-info-monsters",
    "sourceAuthority": "community-maintained-database",
    "sourceUrl": "https://www.spiritvale.info/monsters",
    "publisher": "SpiritVale Info community maintainers",
    "verificationLevel": 2,
    "lastChecked": "2026-08-10T00:00:00Z",
    "allowedFields": ["name", "level", "location", "drop", "notes"]
  }
]
